<?xml version="1.0" encoding="UTF-8"?>
<!-- Marcos Manteca Lozano-->
<tar:tarea idTarea="TOXXI-00001" xmlns:xi="http://www.w3.org/2001/XInclude"
xmlns:tar="http://www.piat.upm.es/tarea" 
xmlns:xsi="http://www.w3.org/2001/XMLSchema-instance"
xsi:schemaLocation="http://www.piat.upm.es/tarea Tarea.xsd">
    <tar:descripcionTarea>Esta tarea requiere la especificación de la ubicación utilizando el formato KML.</tar:descripcionTarea>
    <tar:espacioTarea>
        <tar:volumenEspacio>
            <tar:centro>
                <tar:longitud>80</tar:longitud>
                <tar:latitud>40</tar:latitud>
                <tar:altitud>1000</tar:altitud>
            </tar:centro>
            <tar:forma>cuadrado</tar:forma>
            <tar:altura>3</tar:altura>
        </tar:volumenEspacio>
    </tar:espacioTarea>
</tar:tarea>